{
  "$schema": "https://json-schema.org/draft/2020-12/schema",
  "$id": "https://flight-path-hud.local/contracts/wire/mode-change-frame.schema.json",
  "title": "Mode-change lifecycle frame (protocol v0 producer contract)",
  "type": "object",
  "additionalProperties": false,
  "required": ["type", "requestId", "sysId", "compId", "mode", "customMode", "actor", "requestedAtMs", "confirmation", "status", "ackResult", "observed", "attempts", "reason", "updatedAtMs"],
  "properties": {
    "type": { "const": "modeChange" },
    "requestId": { "type": ["string", "null"], "minLength": 1 },
    "sysId": { "type": ["integer", "null"], "minimum": 1, "maximum": 255, "x-wire-type": "uint8" },
    "compId": { "type": ["integer", "null"], "minimum": 1, "maximum": 255, "x-wire-type": "uint8" },
    "mode": { "type": ["string", "null"], "minLength": 1 },
    "customMode": { "type": ["integer", "null"], "minimum": 0, "maximum": 4294967295, "x-wire-type": "uint32" },
    "actor": { "type": ["string", "null"] },
    "requestedAtMs": { "type": ["number", "null"], "x-wire-type": "float64-ms" },
    "confirmation": { "type": "boolean" },
    "status": { "enum": ["awaitingAck", "awaitingObservation", "complete", "failed"] },
    "ackResult": { "type": ["integer", "null"], "minimum": 0, "maximum": 255, "x-wire-type": "uint8" },
    "observed": { "type": "boolean" },
    "attempts": { "type": "integer", "minimum": 0 },
    "reason": { "type": ["string", "null"] },
    "updatedAtMs": { "type": "number", "x-wire-type": "float64-ms" }
  }
}
